{
  "$schema": "../schemas/deployment.schema.json",
  "version": 1,
  "name": "qwen-vscode-dflash2",
  "model": {
    "id": "qwen3.8-27b",
    "name": "Qwen3.8 27B (Unsloth UD-Q4_K_XL, 100K, DFlash 2)",
    "path": "/home/ellie/.cache/lm-tools/models/Qwen3.8-27B-UD-Q4_K_XL.gguf",
    "source": {
      "url": "https://huggingface.co/unsloth/Qwen3.8-27B-GGUF/resolve/4ca720788d1e01f1bff70c033e0d0028fd02e502/Qwen3.8-27B-UD-Q4_K_XL.gguf",
      "size": 17559178144,
      "sha256": "3f227079003add2511437e5b1e94812e363385225bf6a9b47b0054a72bc8b01e"
    },
    "capabilities": {
      "tools": true,
      "vision": false,
      "reasoning": true,
      "streaming": true,
      "supportedReasoningLevels": ["none", "low", "medium", "xhigh"]
    }
  },
  "runtime": {
    "contextWindow": 102400,
    "maxOutputTokens": 16384,
    "expectedVramMiB": 21100
  },
  "backend": {
    "kind": "llama.cpp",
    "executable": "/home/ellie/git/lm-tools/vendor/llama.cpp-dflash2/build-vulkan/bin/llama-server",
    "vendor": {
      "manifest": "../vendors/llama-dflash2.json",
      "artifact": "llama-server"
    },
    "listen": {
      "host": "127.0.0.1",
      "port": 8080
    },
    "gpuLayers": "all",
    "flashAttention": true,
    "kvCache": {
      "key": "q8_0",
      "value": "q4_0"
    },
    "batch": {
      "logical": 1024,
      "physical": 256
    },
    "parallel": 1,
    "ui": true,
    "speculative": {
      "kind": "dflash",
      "model": {
        "path": "/home/ellie/.cache/lm-tools/models/Qwen3.8-27B-DFlash2-Q4_K_M.gguf",
        "source": {
          "url": "https://huggingface.co/incoai/Qwen3.8-27B-DFlash2-GGUF/resolve/6cb5872e2cee6b4e780a8414922350be8e42d65c/Qwen3.8-27B-DFlash2-Q4_K_M.gguf",
          "size": 1143006752,
          "sha256": "18a380efc9b7ed8d88677fc895f5c11ae170653434ee378f7348f715c14d0594"
        }
      },
      "draftTokens": 4
    }
  },
  "compatibility": {
    "responsesProxy": {
      "enabled": true,
      "listen": {
        "host": "127.0.0.1",
        "port": 1235
      }
    }
  },
  "exposure": {
    "tailscaleServe": {
      "enabled": true,
      "executable": "/usr/bin/tailscale",
      "httpsPort": 443
    }
  },
  "clients": {
    "vscode": {
      "enabled": true,
      "configPath": "/home/ellie/.config/Code/User/chatLanguageModels.json",
      "providerName": "Local Qwen",
      "vendor": "customendpoint",
      "reasoningEffort": "high"
    }
  }
}
