{
  "$schema": "../schemas/deployment.schema.json",
  "version": 1,
  "name": "talkie-web",
  "model": {
    "id": "talkie-1930-13b-it",
    "name": "Talkie 1930 13B IT (Vulkan-fixed Q5_K_M)",
    "path": "/home/ellie/.local/share/lm-tools/models/talkie-1930-13b-it.Q5_K_M.gguf",
    "source": {
      "url": "https://huggingface.co/zakarth/talkie-1930-13b-it-vulkan-fixed-GGUF/resolve/main/talkie-1930-13b-it.Q5_K_M.gguf?download=true",
      "size": 9861698336,
      "sha256": "c9ab17b73b12be0b701cbaece8fa7e235139fb6457e675daaef029060ce13735"
    },
    "capabilities": {
      "tools": false,
      "vision": false,
      "reasoning": false,
      "streaming": true
    }
  },
  "runtime": {
    "contextWindow": 2048,
    "maxOutputTokens": 2048
  },
  "backend": {
    "kind": "llama.cpp",
    "executable": "/usr/bin/llama-server",
    "listen": {
      "host": "127.0.0.1",
      "port": 8187
    },
    "gpuLayers": "all",
    "flashAttention": true,
    "kvCache": {
      "key": "f16",
      "value": "f16"
    },
    "batch": {
      "logical": 256,
      "physical": 128
    },
    "parallel": 1,
    "ui": false,
    "speculative": {
      "kind": "none"
    }
  },
  "compatibility": {
    "responsesProxy": {
      "enabled": false
    }
  },
  "clients": {
    "vscode": {
      "enabled": false
    }
  },
  "services": [
    {
      "kind": "process",
      "name": "talkie-web",
      "executable": "/usr/bin/node",
      "args": ["server.js", "--backend=llama"],
      "cwd": "/home/ellie/git/talkie-1930-13b-it-q5",
      "environment": {
        "PORT": "5177",
        "TALKIE_BACKEND": "llama",
        "LLAMA_EXTERNAL": "1",
        "LLAMA_BASE_URL": "http://127.0.0.1:8187",
        "LLAMA_MODEL": "/home/ellie/.local/share/lm-tools/models/talkie-1930-13b-it.Q5_K_M.gguf",
        "LLAMA_MODEL_ALIAS": "talkie-1930-13b-it"
      },
      "ready": {
        "url": "http://127.0.0.1:5177/api/status",
        "timeoutSeconds": 30
      }
    }
  ]
}
