{
  "$schema": "../schemas/deployment.schema.json",
  "version": 1,
  "name": "diffusiongemma-lab",
  "model": {
    "id": "diffusiongemma-26b-a4b-it",
    "name": "DiffusionGemma 26B A4B IT (Q4_K_M)",
    "path": "/home/ellie/.local/share/lm-tools/models/diffusiongemma-26B-A4B-it-Q4_K_M.gguf",
    "source": {
      "url": "https://huggingface.co/unsloth/diffusiongemma-26B-A4B-it-GGUF/resolve/main/diffusiongemma-26B-A4B-it-Q4_K_M.gguf?download=true",
      "size": 16806810208,
      "sha256": "24523b6c833c9ce9f5f34f9b333ab1517d73d6f1e76a103645353114c8028bc5"
    },
    "capabilities": {
      "tools": false,
      "vision": false,
      "reasoning": true,
      "streaming": true,
      "supportedReasoningLevels": ["none"]
    }
  },
  "runtime": {
    "contextWindow": 262144,
    "maxOutputTokens": 256
  },
  "backend": {
    "kind": "llama.cpp-diffusion",
    "executable": "/home/ellie/git/lm-tools/vendor/llama.cpp-diffusiongemma/build-vulkan/bin/llama-diffusion-cli",
    "device": "Vulkan0",
    "gpuLayers": "all",
    "flashAttention": "auto",
    "fit": {
      "enabled": false,
      "marginMiB": 1024
    }
  },
  "compatibility": {
    "responsesProxy": {
      "enabled": false
    }
  },
  "clients": {
    "vscode": {
      "enabled": false
    }
  },
  "services": [
    {
      "kind": "diffusiongemma-lab",
      "name": "diffusiongemma-lab",
      "checkout": "/home/ellie/git/lm-tools/vendor/diffusiongemma-lab",
      "listen": {
        "host": "127.0.0.1",
        "port": 49387
      },
      "readyTimeoutSeconds": 60
    }
  ]
}
