{
  "$schema": "../schemas/deployment.schema.json",
  "version": 1,
  "name": "qwen-campaign-agent",
  "model": {
    "id": "qwen3.8-27b",
    "name": "Qwen3.8 27B campaign worker (Unsloth UD-Q4_K_XL, 100K)",
    "path": "/home/ellie/.cache/lm-tools/models/Qwen3.8-27B-UD-Q4_K_XL.gguf",
    "source": {
      "url": "https://huggingface.co/unsloth/Qwen3.8-27B-GGUF/resolve/4ca720788d1e01f1bff70c033e0d0028fd02e502/Qwen3.8-27B-UD-Q4_K_XL.gguf",
      "size": 17559178144,
      "sha256": "3f227079003add2511437e5b1e94812e363385225bf6a9b47b0054a72bc8b01e"
    },
    "capabilities": {
      "tools": true,
      "vision": false,
      "reasoning": true,
      "streaming": true,
      "supportedReasoningLevels": ["none", "low", "medium", "xhigh"]
    }
  },
  "runtime": {
    "contextWindow": 102400,
    "maxOutputTokens": 16384,
    "expectedVramMiB": 20000
  },
  "resources": {
    "gpu": {
      "mode": "exclusive",
      "conflictingExecutables": ["/usr/bin/llama-server"],
      "shutdownGraceSeconds": 5,
      "vram": {
        "devicePath": "/sys/class/drm/card1/device",
        "minimumRemainingMiB": 1536
      }
    }
  },
  "backend": {
    "kind": "llama.cpp",
    "executable": "/usr/bin/llama-server",
    "listen": {
      "host": "127.0.0.1",
      "port": 8080
    },
    "gpuLayers": "all",
    "flashAttention": true,
    "kvCache": {
      "key": "q8_0",
      "value": "q4_0"
    },
    "batch": {
      "logical": 1024,
      "physical": 256
    },
    "parallel": 1,
    "ui": false,
    "speculative": {
      "kind": "mtp",
      "draftTokens": 2
    }
  },
  "compatibility": {
    "responsesProxy": {
      "enabled": true,
      "listen": {
        "host": "127.0.0.1",
        "port": 1235
      }
    }
  },
  "exposure": {
    "tailscaleServe": {
      "enabled": false
    }
  },
  "clients": {
    "vscode": {
      "enabled": false
    }
  }
}
